{
  "schema_version": 2,
  "scope": "Evidence index, not execution authority or deployment certification",
  "real_flight_validated": false,
  "track_d": {
    "D1": {
      "label": "Independent asset loader",
      "status": "COMPLETE",
      "evidence": "results/renderer_urdf_smoke_2026-09-11/README.md"
    },
    "D2": {
      "label": "Independent renderer",
      "status": "COMPLETE",
      "evidence": "results/renderer_cpu_install_2026-09-12/README.md"
    },
    "D3": {
      "label": "Background engineering validation",
      "status": "TECHNICAL_PASS",
      "evidence": "results/renderer_background_v1_clean_2026-09-11/README.md"
    },
    "D4": {
      "label": "R4/R4b statistical criterion",
      "status": "FAIL",
      "evidence": "results/renderer_reverification_2026-09-11_1951/README.md"
    },
    "D5": {
      "label": "Historical simulator visual probe",
      "status": "PARTIAL_EVIDENCE",
      "evidence": "results/target_appearance_in_sim_2026-09-12/AUDIT.md"
    },
    "D6": {
      "label": "Standalone mesh feasibility",
      "status": "INCONCLUSIVE",
      "evidence": "results/dynamic_mesh_raycast_feasibility_2026-09-12/README.md"
    },
    "D7": {
      "label": "Integrated shadow cost / non-interference",
      "status": "GO",
      "evidence": "results/dynamic_mesh_integrated_cost_2026-09-12/README.md"
    },
    "D8": {
      "label": "D8-A observation technical gate (D8b sensitivity recorded separately)",
      "status": "TECHNICAL_GO",
      "evidence": "results/dynamic_mesh_detector_d8a_attempt2_2026-09-13/README.md"
    },
    "D9": {
      "label": "Shortcut remeasurement",
      "status": "NOT_RUN",
      "evidence": "docs/track_d_state_2026-09-12.md"
    }
  },
  "limits": {
    "integrated_simulator_cost": "D8A_TECHNICAL_ONLY",
    "e3p": "ATTITUDE_NOT_RELIABLE",
    "c3": "WITHDRAWN",
    "ppo_replication": "INCONCLUSIVE"
  }
}
